rating_id,order_id,rating,review
1,1,3,Increase democratic mention generation book question.
2,2,2,Main project animal house out account feeling deep.
3,3,3,Share face build market.
4,4,5,Compare herself region matter street south.
5,5,4,However score job least.
6,6,2,Television office of remember.
7,7,3,Face if whom commercial way least.
8,8,4,Because such during open model how.
9,9,1,Second develop single baby plan.
10,10,3,Member town glass road standard spring door.
11,11,2,Eight community check service.
12,12,3,Concern significant management senior.
13,13,3,Large under north play person ten physical character.
14,14,3,Light place someone option.
15,15,5,Medical financial later arm story baby.
16,16,1,Past medical leg never.
17,17,2,Last special prepare.
18,18,2,Painting may whatever late specific study.
19,19,2,Mean common easy just.
20,20,4,Model particular hair truth hold simple.
21,21,2,Appear piece free form newspaper hit edge surface.
22,22,2,Their four old center glass whose recognize hot.
23,23,1,Remember be next poor foreign campaign reflect water.
24,24,4,Behavior provide meet adult final week game.
25,25,4,Court yourself choice fast small medical music.
26,26,3,Also from short capital heavy class story.
27,27,5,Speak close join improve put down know expect.
28,28,4,Doctor dream whole six tough create question.
29,29,4,Worker left example high month whom stage.
30,30,1,Catch economic political them never bill suffer surface.
